_id,Card Name,Mana Cost,Converted Mana Cost,Card Type,Card Text,Flavor Text,Set,Other Sets,Rarity,Card Number,Artist,Community Rating,Number of Voters,Image URL
601f096fa21962abbfd200de,"Ach! Hans, Run!",2 Red Red Green Green ,6,Enchantment,"At the beginning of your upkeep, you may say ""Ach Hans, run It's the . . ."" and name a creature card. If you do, search your library for the named card, put it into play, then shuffle your library. That creature has haste. Remove it from the game at end of turn. ",false,Unhinged,false,Rare,116,Quinton Hoover,4.432,88,https://gatherer.wizards.com/Handlers/Image.ashx?multiverseid=73935&type=card
601f0971a21962abbfd200df,Rumors of My Death . . .,2 Black ,3,Enchantment,"3 Black , Exile a permanent you control with a League of Dastardly Doom watermark: Return a permanent card with a League of Dastardly Doom watermark from your graveyard to the battlefield. ","By the fourth funeral, the mooks had gotten pretty good at them.",Unstable,false,Uncommon,65,Alex Konstad,5,0,https://gatherer.wizards.com/Handlers/Image.ashx?multiverseid=439454&type=card
601f0972a21962abbfd200e0,A Good Thing,4 White Black ,6,Enchantment,"Spells and abilities you control can't destroy, exile, target, or cause you to sacrifice CARDNAME. At the beginning of your upkeep, double your life total. Then, if you have 1,000 or more life, you lose the game. ",false,Mystery Booster,false,Common,86,Yoni Skolnik,5,0,https://gatherer.wizards.com/Handlers/Image.ashx?multiverseid=476216&type=card
601f0973a21962abbfd200e1,Abandon Hope,Variable Colorless 1 Black ,2,Sorcery,"Choose and discard X cards: Look at target opponent's hand and choose X of those cards. That player discards the chosen cards. ","As Gerrard's form vanished into the maw of trees, Hanna mouthed a silent plea, mourning a crushed dream.",Tempest,false,Uncommon,-1,Alan Pollack,2.823,48,https://gatherer.wizards.com/Handlers/Image.ashx?multiverseid=4635&type=card
601f0974a21962abbfd200e2,Abandon Reason,2 Red ,3,Instant,"Up to two target creatures each get +1/+0 and gain first strike until end of turn. 1 Red Madness (If you discard this card, discard it into exile. When you do, cast it for its madness cost or put it into your graveyard.) ",false,Eldritch Moon,false,Uncommon,115,Josh Hass,5,0,https://gatherer.wizards.com/Handlers/Image.ashx?multiverseid=414412&type=card
601f0975a21962abbfd200e3,Abandoned Outpost,false,-1,Land,"Abandoned Outpost comes into play tapped. ocT: Add oW to your mana pool. ocT, Sacrifice Abandoned Outpost: Add one mana of any color to your mana pool. ",false,Odyssey,false,Common,312,"Edward P. Beard, Jr.",2.24,48,https://gatherer.wizards.com/Handlers/Image.ashx?multiverseid=31761&type=card
601f0977a21962abbfd200e4,Abandoned Sarcophagus,3 ,3,Artifact,"You may cast spells that have a cycling ability from your graveyard. If a card that has a cycling ability would be put into your graveyard from anywhere and it wasn't cycled, exile it instead. ","Although long since dead, the banished dissenters finally took their vengeance.",Ikoria Commander,"Hour of Devastation (Rare) , Ikoria Commander (Rare) , ",Rare,236,Daarken,5,0,https://gatherer.wizards.com/Handlers/Image.ashx?multiverseid=482864&type=card
601f0978a21962abbfd200e5,Abattoir Ghoul,3 Black ,4,Creature — Zombie,"First strike Whenever a creature dealt damage by Abattoir Ghoul this turn dies, you gain life equal to that creature's toughness. ",Death took his humanity but not his skill with the knife.,Duel Decks: Blessed vs. Cursed,"Innistrad (Uncommon) , Duel Decks: Blessed vs. Cursed (Uncommon) , ",Uncommon,50,Volkan Baga,5,0,https://gatherer.wizards.com/Handlers/Image.ashx?multiverseid=409626&type=card
601f0979a21962abbfd200e6,Abbey Gargoyles,2 White White White ,5,Creature - Gargoyle,"Flying, protection from red ","""Though Serra has not been seen for twenty years, her gargoyles still watch over our city and punish the guilty.""",Masters Edition II,"Fifth Edition (Uncommon) , Homelands (Uncommon) , Masters Edition II (Uncommon) , ",Uncommon,1,Christopher Rush,2.76,50,https://gatherer.wizards.com/Handlers/Image.ashx?multiverseid=184585&type=card
601f097aa21962abbfd200e7,Abbey Griffin,3 White ,4,Creature — Griffin,"Flying, vigilance ","""The darkness crawls with vampires and ghouls, but we are not without allies.""",Innistrad,false,Common,1,Jaime Jones,2.165,85,https://gatherer.wizards.com/Handlers/Image.ashx?multiverseid=235595&type=card
601f097ca21962abbfd200e8,Abbey Matron,2 White ,3,Summon - Cleric,"oW, ocT: +0/+3 until end of turn ","""The Matrons are kindly souls, but don't ask one for an ale.""",Homelands,false,Common,-1,Mike Kimble,1.983,58,https://gatherer.wizards.com/Handlers/Image.ashx?multiverseid=3011&type=card
601f097da21962abbfd200e9,Abbot of Keral Keep,1 Red ,2,Creature — Human Monk,"Prowess (Whenever you cast a noncreature spell, this creature gets +1/+1 until end of turn.)When Abbot of Keral Keep enters the battlefield, exile the top card of your library. Until end of turn, you may play that card. ",false,Magic Origins,false,Rare,127,Deruchenko Alexander,5,0,https://gatherer.wizards.com/Handlers/Image.ashx?multiverseid=398411&type=card
601f097fa21962abbfd200ea,Abduction,2 Blue Blue ,4,Enchant Creature,"When Abduction comes into play, untap enchanted creature. Gain control of enchanted creature. If enchanted creature is put into any graveyard, put that creature into play under its owner's control. ",false,Weatherlight,"Classic Sixth Edition (Uncommon) , Weatherlight (Uncommon) , ",Uncommon,-1,Colin MacNeil,3.636,33,https://gatherer.wizards.com/Handlers/Image.ashx?multiverseid=4476&type=card
601f0982a21962abbfd200eb,Aberrant Researcher,3 Blue ,4,4,"Flying At the beginning of your upkeep, put the top card of your library into your graveyard. If it's an instant or sorcery card, transform Aberrant Researcher.  ","The final pages of the experiment log were blank. Investigators found it abandoned on a desk in the researcher's lab, open, the pages flipping in the wind from a shattered window.",Shadows over Innistrad,false,Uncommon,-1,Nils Hamm,5,0,https://gatherer.wizards.com/Handlers/Image.ashx?multiverseid=409790&type=card
601f0982a21962abbfd200ec,Perfected Form,false,-1,4,Flying  ,false,Shadows over Innistrad,false,Uncommon,-1,Nils Hamm,5,0,https://gatherer.wizards.com/Handlers/Image.ashx?multiverseid=409790&type=card
601f0983a21962abbfd200ed,Abeyance,1 White ,2,Instant,"Until end of turn, target player cannot play instants, interrupts, sorceries, or abilities requiring an activation cost. Draw a card. ","""I'm too modest a wizard to reveal the full extent of my abilities.""",Weatherlight,false,Rare,-1,Thomas Gianni,4.466,87,https://gatherer.wizards.com/Handlers/Image.ashx?multiverseid=4563&type=card
601f0984a21962abbfd200ee,Abhorrent Overlord,5 Black Black ,7,Creature — Demon,"Flying Black When Abhorrent Overlord enters the battlefield, put a number of 1/1 black Harpy creature tokens with flying onto the battlefield equal to your devotion to black. (Each in the mana costs of permanents you control counts toward your devotion to black.) At the beginning of your upkeep, sacrifice a creature. ",false,Theros,false,Rare,75,Slawomir Maniak,3.466,87,https://gatherer.wizards.com/Handlers/Image.ashx?multiverseid=373661&type=card
601f0985a21962abbfd200ef,"Abian, Luvion Usurper",5 Red Green ,7,Legendary Planeswalker — Abian,"As CARDNAME enters the battlefield, you become Abian. <i>(Your life total becomes equal to their loyalty. You can activate the loyalty abilities by spending or gaining life.)</i> +3: Discard your hand, then draw cards equal to the greatest power among creatures you control. +1: Create a 3/2 red and green Spirit creature token. −X: You deal X damage to any target. ",false,Mystery Booster,false,Common,87,James Kooi,5,0,https://gatherer.wizards.com/Handlers/Image.ashx?multiverseid=476217&type=card
601f0986a21962abbfd200f0,Abjure,Blue ,1,Interrupt,Sacrifice a blue permanent: Counter target spell. ,"Mirri's hackles rose as Ertai continued expounding his virtues. ""If that arrogant brat doesn't shut up soon,"" she growled to herself, ""I'm going to have to kill him.""",Weatherlight,false,Common,-1,Ted Naifeh,3.057,44,https://gatherer.wizards.com/Handlers/Image.ashx?multiverseid=4477&type=card
601f0988a21962abbfd200f1,Abnormal Endurance,1 Black ,2,Instant,"Until end of turn, target creature gets +2/+0 and gains ""When this creature dies, return it to the battlefield tapped under its owner's control."" ",Tenacity prevails when hopes die.,Core Set 2019,false,Common,85,Tomasz Jedruszek,5,0,https://gatherer.wizards.com/Handlers/Image.ashx?multiverseid=447221&type=card
601f0989a21962abbfd200f2,Abolish,1 White White ,3,Instant,"You may discard a Plains card rather than pay Abolish's mana cost. Destroy target artifact or enchantment. ","As war raged on, the young mages became more direct in their tactics, often at great cost.",Duel Decks: Elspeth vs. Tezzeret,"Prophecy (Uncommon) , Duel Decks: Elspeth vs. Tezzeret (Uncommon) , ",Uncommon,29,Kev Walker,4.279,61,https://gatherer.wizards.com/Handlers/Image.ashx?multiverseid=222765&type=card
601f098ca21962abbfd200f3,Voldaren Pariah,3 Black Black ,5,5,"Flying Sacrifice three other creatures: Transform Voldaren Pariah. Black Black Black Madness (If you discard this card, discard it into exile. When you do, cast it for its madness cost or put it into your graveyard.)  ",false,Eldritch Moon,false,Rare,-1,James Ryman,5,0,https://gatherer.wizards.com/Handlers/Image.ashx?multiverseid=414407&type=card
601f098ca21962abbfd200f4,Abolisher of Bloodlines,false,-1,5,"Flying When this creature transforms into Abolisher of Bloodlines, target opponent sacrifices three creatures.  ",false,Eldritch Moon,false,Rare,-1,James Ryman,5,0,https://gatherer.wizards.com/Handlers/Image.ashx?multiverseid=414407&type=card
601f098da21962abbfd200f5,Abominable Treefolk,2 Green Blue ,4,Snow Creature — Treefolk,"Trample Abominable Treefolk's power and toughness are each equal to the number of snow permanents you control. When Abominable Treefolk enters the battlefield, tap target creature an opponent controls. That creature doesn't untap during its controller's next untap step. ",false,Modern Horizons,false,Uncommon,194,Jonas De Ro,5,0,https://gatherer.wizards.com/Handlers/Image.ashx?multiverseid=464143&type=card
601f098ea21962abbfd200f6,Abomination,3 Black Black ,5,Summon - Abomination,All green or white creatures blocking or blocked by Abomination are destroyed at the end of combat. ,false,Legends,"Fourth Edition (Uncommon) , Legends (Uncommon) , ",Uncommon,-1,Mark Tedin,2.784,44,https://gatherer.wizards.com/Handlers/Image.ashx?multiverseid=1427&type=card
601f098fa21962abbfd200f7,Abomination of Gudul,3 Black Green Blue ,6,Creature — Horror,"Flying Whenever Abomination of Gudul deals combat damage to a player, you may draw a card. If you do, discard a card. 2 Black Green Blue 3 Morph (You may cast this card face down as a 2/2 creature for . Turn it face up any time for its morph cost.) ",false,Khans of Tarkir,false,Common,159,Erica Yang,2.286,7,https://gatherer.wizards.com/Handlers/Image.ashx?multiverseid=386463&type=card
601f0990a21962abbfd200f8,Abomination of Llanowar,1 Black Green ,3,Legendary Creature — Elf Horror,"Vigilance; menace <i>(This creature can't be blocked except by two or more creatures.)</i> Abomination of Llanowar's power and toughness are each equal to the number of Elves you control plus the number of Elf cards in your graveyard. ","""Run!"" screamed its living mouths. ""Come!"" cried its dead ones.",Kaldheim Commander,"Commander Legends (Uncommon) , Kaldheim Commander (Uncommon) , ",Uncommon,81,Vincent Proce,5,0,https://gatherer.wizards.com/Handlers/Image.ashx?multiverseid=508371&type=card
601f0991a21962abbfd200f9,Aboroth,4 Green Green ,6,Summon - Aboroth,Cumulative upkeep—Put a -1/-1 counter on Aboroth ,"The Weatherlight banked sharply as the colossal beast rose up to crush the lone rider. ""My bet's on the dirt,"" Gerrard said flatly.",Weatherlight,false,Rare,-1,Brom,3.258,60,https://gatherer.wizards.com/Handlers/Image.ashx?multiverseid=4505&type=card
601f0993a21962abbfd200fa,"Aboshan, Cephalid Emperor",4 Blue Blue ,6,Creature - Cephalid Legend,Tap an untapped Cephalid you control: Tap target permanent. oUoUoU: Tap all creatures without flying. ,"""No one can fight the tide forever.""",Odyssey,false,Rare,58,Christopher Moeller,3.918,61,https://gatherer.wizards.com/Handlers/Image.ashx?multiverseid=31821&type=card
601f0994a21962abbfd200fb,"Aboshan's Desire",Blue ,1,Enchant Creature,"Enchanted creature has flying. Threshold Enchanted creature can't be the target of spells or abilities. (You have threshold as long as seven or more cards are in your graveyard.) ",false,Odyssey,false,Common,59,Ciruelo,3.105,43,https://gatherer.wizards.com/Handlers/Image.ashx?multiverseid=29728&type=card
601f0995a21962abbfd200fc,About Face,Red ,1,Instant,"Switch target creature's power and toughness until end of turn. Effects that alter the creature's power alter its toughness instead, and vice versa, this turn. ",The overconfident are the most vulnerable.,"Urza's Legacy",false,Common,73,Melissa A. Benson,3.398,44,https://gatherer.wizards.com/Handlers/Image.ashx?multiverseid=12414&type=card
601f0996a21962abbfd200fd,Abrade,1 Red ,2,Instant,Choose one — • Abrade deals 3 damage to target creature. • Destroy target artifact. ,"The desert is a voracious beast, devouring both flesh and stone.",Commander Legends,"Hour of Devastation (Uncommon) , Double Masters (Common) , Commander Legends (Uncommon) , ",Uncommon,410,Jonas De Ro,5,0,https://gatherer.wizards.com/Handlers/Image.ashx?multiverseid=500890&type=card
601f0997a21962abbfd200fe,Abrupt Decay,Black Green ,2,Instant,"This spell can't be countered. Destroy target nonland permanent with converted mana cost 3 or less. ",The Izzet quickly suspended their policy of lifetime guarantees.,Guild Kit: Golgari,"Return to Ravnica (Rare) , Modern Masters 2017 Edition (Rare) , Guild Kit: Golgari (Rare) , ",Rare,57,Svetlin Velinov,5,0,https://gatherer.wizards.com/Handlers/Image.ashx?multiverseid=456061&type=card
601f0999a21962abbfd200ff,Absolute Grace,1 White ,2,Enchantment,All creatures gain protection from black. ,"In pursuit of Urza, the Phyrexians sent countless foul legions into Serra's realm. Though beaten back, they left it tainted with uncleansable evil.","Urza's Saga",false,Uncommon,1,Jeff Miracola,3.615,48,https://gatherer.wizards.com/Handlers/Image.ashx?multiverseid=5716&type=card
601f099aa21962abbfd20100,Absolute Law,1 White ,2,Enchantment,All creatures gain protection from red. ,The strength of law is unwavering. It is an iron bar in a world of water.,"Urza's Saga",false,Uncommon,2,Mark Zug,3.716,44,https://gatherer.wizards.com/Handlers/Image.ashx?multiverseid=8437&type=card
601f099ba21962abbfd20101,Absolver Thrull,3 White ,4,Creature - Thrull Cleric,"Haunt (When this card is put into a graveyard from play, remove it from the game haunting target creature.) When Absolver Thrull comes into play or the creature it haunts is put into a graveyard, destroy target enchantment. ",false,Guildpact,false,Common,1,Rob Alexander,2.963,54,https://gatherer.wizards.com/Handlers/Image.ashx?multiverseid=96953&type=card
601f099da21962abbfd20102,Absorb,White Blue Blue ,3,Instant,Counter target spell. You gain 3 life. ,"""In your misguided attempt to subvert the law, you have eloquently explained why the law must exist.""",Ravnica Allegiance,"Invasion (Rare) , Ravnica Allegiance (Rare) , ",Rare,151,Izzy,5,0,https://gatherer.wizards.com/Handlers/Image.ashx?multiverseid=457295&type=card
601f099ea21962abbfd20103,Absorb Identity,1 Blue ,2,Instant,"Return target creature to its owner's hand. You may have Shapeshifters you control become copies of that creature until end of turn. ",false,Kaldheim,false,Uncommon,383,Matt Stewart,5,0,https://gatherer.wizards.com/Handlers/Image.ashx?multiverseid=506925&type=card
601f09a1a21962abbfd20104,Absorb Vis,6 Black ,7,Sorcery,"Target player loses 4 life and you gain 4 life. 1 Black 1 Black Basic landcycling (, Discard this card: Search your library for a basic land card, reveal it, and put it into your hand. Then shuffle your library.) ",false,Conspiracy: Take the Crown,"Conflux (Common) , Duel Decks: Sorin vs. Tibalt (Common) , Modern Masters (Common) , Conspiracy: Take the Crown (Common) , ",Common,126,Brandon Kitkouski,5,0,https://gatherer.wizards.com/Handlers/Image.ashx?multiverseid=416883&type=card
601f09a2a21962abbfd20105,Abstract Iguanart,1 Red ,2,Creature — Art Lizard,"Whenever you cast a spell, note the first letter of its artist's name. If that letter wasn't already noted, put a +1/+1 counter on Abstract Iguanart.  ",Another moving piece by the artist El Gecko.,Unsanctioned,false,Uncommon,47,Chris Seaman,5,0,https://gatherer.wizards.com/Handlers/Image.ashx?multiverseid=479439&type=card
601f09a3a21962abbfd20106,Abstruse Interference,2 Blue ,3,Instant,"Devoid (This card has no color.) 1 Colorless Colorless Counter target spell unless its controller pays . You put a 1/1 colorless Eldrazi Scion creature token onto the battlefield. It has ""Sacrifice this creature: Add to your mana pool."" ( represents colorless mana.) ",false,Oath of the Gatewatch,false,Common,40,Igor Kieryluk,5,0,https://gatherer.wizards.com/Handlers/Image.ashx?multiverseid=407550&type=card
601f09a4a21962abbfd20107,"Abu Ja'far",White ,1,Summon - Leper,"If Abu Ja'far is put into the graveyard from play during combat, bury all creatures blocking or blocked by Abu Ja'far. ",false,Chronicles,"Arabian Nights (Uncommon) , Chronicles (Uncommon) , ",Uncommon,-1,"Ken Meyer, Jr.",3.797,69,https://gatherer.wizards.com/Handlers/Image.ashx?multiverseid=2838&type=card
601f09a6a21962abbfd20108,Abuna Acolyte,1 White ,2,Creature — Cat Cleric,Tap : Prevent the next 1 damage that would be dealt to target creature or player this turn. Tap : Prevent the next 2 damage that would be dealt to target artifact creature this turn. ,"""You can break nothing I cannot mend.""",Scars of Mirrodin,false,Uncommon,1,Igor Kieryluk,2.667,66,https://gatherer.wizards.com/Handlers/Image.ashx?multiverseid=194371&type=card
601f09a7a21962abbfd20109,"Abuna's Chant",3 White ,4,Instant,Choose one You gain 5 life; or prevent the next 5 damage that would be dealt to target creature this turn. 2 Entwine (Choose both if you pay the entwine cost.) ,false,Fifth Dawn,false,Common,1,John Matson,2.167,36,https://gatherer.wizards.com/Handlers/Image.ashx?multiverseid=50164&type=card
601f09a8a21962abbfd2010a,Abundance,2 Green Green ,4,Enchantment,"If you would draw a card, you may instead choose land or nonland and reveal cards from the top of your library until you reveal a card of the chosen kind. Put that card into your hand and put all other cards revealed this way on the bottom of your library in any order. ",false,Zendikar Rising Commander,"Urza's Saga (Rare) , Tenth Edition (Rare) , Duel Decks: Nissa vs. Ob Nixilis (Rare) , Commander 2017 (Rare) , Zendikar Rising Commander (Rare) , ",Rare,58,Rebecca Guay,5,0,https://gatherer.wizards.com/Handlers/Image.ashx?multiverseid=495996&type=card
601f09a9a21962abbfd2010b,Abundant Growth,Green ,1,Enchantment — Aura,"Enchant land When Abundant Growth enters the battlefield, draw a card. Tap Enchanted land has "": Add one mana of any color to your mana pool."" ",false,Eternal Masters,"Avacyn Restored (Common) , Eternal Masters (Common) , ",Common,156,Vincent Proce,5,0,https://gatherer.wizards.com/Handlers/Image.ashx?multiverseid=413698&type=card
601f09aba21962abbfd2010c,Abundant Maw,8 ,8,Creature — Eldrazi Leech,"6 Black Emerge (You may cast this spell by sacrificing a creature and paying the emerge cost reduced by that creature's converted mana cost.) When you cast Abundant Maw, target opponent loses 3 life and you gain 3 life. ",false,Eldritch Moon,false,Uncommon,1,Greg Staples,5,0,https://gatherer.wizards.com/Handlers/Image.ashx?multiverseid=414290&type=card
601f09aba21962abbfd2010d,Abyssal Gatekeeper,1 Black ,2,Creature — Horror,"When Abyssal Gatekeeper dies, each player sacrifices a creature. ","""There are two ways for me to pass this gate. One involves you remaining conscious.""","Duel Decks Anthology, Divine vs. Demonic","Weatherlight (Common) , Duel Decks: Divine vs. Demonic (Common) , Duel Decks Anthology, Divine vs. Demonic (Common) , ",Common,31,Mark Tedin,5,0,https://gatherer.wizards.com/Handlers/Image.ashx?multiverseid=394003&type=card
601f09ada21962abbfd2010e,Abyssal Horror,4 Black Black ,6,Creature - Horror,"Flying When Abyssal Horror comes into play, target player chooses and discards two cards from his or her hand. (If that player has only one card, he or she discards it.) ",false,Starter 1999,"Seventh Edition (Rare) , Urza's Saga (Rare) , Starter 1999 (Rare) , ",Rare,63,rk post,2.289,38,https://gatherer.wizards.com/Handlers/Image.ashx?multiverseid=21019&type=card
601f09aea21962abbfd2010f,Abyssal Hunter,3 Black ,4,Summon - Hunter,"oB, ocT: Tap target creature. Abyssal Hunter deals to that creature an amount of damage equal to Abyssal Hunter's power. ",Some smiles show cheer; some merely show teeth.,Mirage,"Classic Sixth Edition (Rare) , Mirage (Rare) , ",Rare,-1,Steve Luke,3.058,43,https://gatherer.wizards.com/Handlers/Image.ashx?multiverseid=3272&type=card
601f09afa21962abbfd20110,Abyssal Nightstalker,3 Black ,4,Creature - Nightstalker,"If Abyssal Nightstalker attacks and isn't blocked, your opponent chooses and discards a card from his or her hand. (Ignore this effect if your opponent doesn't have any cards.) ",false,Portal Second Age,false,Uncommon,-1,Sam Woods,2.859,32,https://gatherer.wizards.com/Handlers/Image.ashx?multiverseid=6567&type=card
601f09b0a21962abbfd20111,Abyssal Nocturnus,1 Black Black ,3,Creature - Horror,"Whenever an opponent discards a card, Abyssal Nocturnus gets +2/+2 and gains fear until end of turn. ","""I fear to keep an open mind, for there are those who would use it as a door to my soul.""",Guildpact,false,Rare,43,Jon Foster,3.604,72,https://gatherer.wizards.com/Handlers/Image.ashx?multiverseid=96858&type=card
601f09b1a21962abbfd20112,Abyssal Persecutor,2 Black Black ,4,Creature — Demon,"Flying, trample You can't win the game and your opponents can't lose the game. ",His slaves crave death more than they desire freedom. He denies them both.,Iconic Masters,"Worldwake (Mythic Rare) , Commander 2014 (Mythic Rare) , Iconic Masters (Rare) , ",Rare,78,Chippy,5,0,https://gatherer.wizards.com/Handlers/Image.ashx?multiverseid=438644&type=card
601f09b2a21962abbfd20113,Abyssal Specter,2 Black Black ,4,Creature — Specter,"Flying Whenever Abyssal Specter deals damage to a player, that player discards a card. ",It rides to a chorus of whispers that are more felt than heard.,Modern Masters 2017 Edition,"Fifth Edition (Uncommon) , Classic Sixth Edition (Uncommon) , Seventh Edition (Uncommon) , Eighth Edition (Uncommon) , Ice Age (Uncommon) , Battle Royale Box Set (Uncommon) , Duel Decks: Divine vs. Demonic (Uncommon) , Duel Decks Anthology, Divine vs. Demonic (Uncommon) , Modern Masters 2017 Edition (Uncommon) , ",Uncommon,59,Daarken,5,0,https://gatherer.wizards.com/Handlers/Image.ashx?multiverseid=425884&type=card
601f09b3a21962abbfd20114,Abzan Advantage,1 White ,2,Instant,Target player sacrifices an enchantment. Bolster 1. (Choose a creature with the least toughness among creatures you control and put a +1/+1 counter on it.) ,"""To survive, you must seize every opportunity.""",Fate Reforged,false,Common,2,Winona Nelson,5,0,https://gatherer.wizards.com/Handlers/Image.ashx?multiverseid=391781&type=card
601f09b5a21962abbfd20115,Abzan Ascendancy,White Black Green ,3,Enchantment,"When Abzan Ascendancy enters the battlefield, put a +1/+1 counter on each creature you control. Whenever a nontoken creature you control dies, create a 1/1 white Spirit creature token with flying. ",false,Ikoria Commander,"Khans of Tarkir (Rare) , Ikoria Commander (Rare) , ",Rare,198,Mark Winters,5,0,https://gatherer.wizards.com/Handlers/Image.ashx?multiverseid=482826&type=card
601f09b6a21962abbfd20116,Abzan Banner,3 ,3,Artifact,"Tap White Black Green : Add , , or to your mana pool. White Black Green Tap , , Sacrifice Abzan Banner: Draw a card. ","Stone to endure, roots to remember.",Khans of Tarkir,false,Common,215,Daniel Ljunggren,2.25,6,https://gatherer.wizards.com/Handlers/Image.ashx?multiverseid=386465&type=card
601f09b7a21962abbfd20117,Abzan Battle Priest,3 White ,4,Creature — Human Cleric,"White White Tap Outlast (, : Put a +1/+1 counter on this creature. Outlast only as a sorcery.) Each creature you control with a +1/+1 counter on it has lifelink. ","""Wherever I walk, the ancestors walk too.""",Iconic Masters,"Khans of Tarkir (Uncommon) , Iconic Masters (Uncommon) , ",Uncommon,2,Chris Rahn,5,0,https://gatherer.wizards.com/Handlers/Image.ashx?multiverseid=438568&type=card
601f09b8a21962abbfd20118,Abzan Beastmaster,2 Green ,3,Creature — Hound Shaman,"At the beginning of your upkeep, draw a card if you control the creature with the greatest toughness or tied for the greatest toughness. ",His beasts move the great siege towers of the Abzan across the endless sands.,Fate Reforged,false,Uncommon,119,Winona Nelson,5,0,https://gatherer.wizards.com/Handlers/Image.ashx?multiverseid=391782&type=card
601f09baa21962abbfd20119,Abzan Charm,White Black Green ,3,Instant,Choose one — • Exile target creature with power 3 or greater. • You draw two cards and you lose 2 life. • Distribute two +1/+1 counters among one or two target creatures. ,false,Ikoria Commander,"Khans of Tarkir (Uncommon) , Commander 2016 (Uncommon) , Ikoria Commander (Uncommon) , ",Uncommon,199,Mathias Kollros,5,0,https://gatherer.wizards.com/Handlers/Image.ashx?multiverseid=482827&type=card
